{
  "$schema": "../../../packages/socket/schemas/plug-manifest.v1.json",
  "schemaVersion": "1.0.0",
  "id": "code-intel-summarize",
  "name": "Docstring Summarizer",
  "owner": "code-intel",
  "version": "0.0.1",
  "description": "Generates natural-language docstrings per AST definition node via the model owner's complete fn, then returns docstring-indexed summaries for embedding. Greptile's core IP (GP-§8a): parse AST → generate docstrings → embed docstrings. The docstring replaces raw code as the embedding target for dramatically better semantic retrieval.",
  "capabilities": [
    "summarize"
  ],
  "targets": {
    "providers": [],
    "plans": [],
    "env": []
  },
  "dependencies": {
    "requires": [],
    "recommends": []
  },
  "permissions": {
    "network": [],
    "filesystem": [],
    "env": [],
    "mutatesTools": false
  },
  "entrypoint": "./plug.ts",
  "hooks": false,
  "mcp": false
}
