{
  "$schema": "../../../packages/socket/schemas/plug-manifest.v1.json",
  "schemaVersion": "1.0.0",
  "id": "rules-baseline-pack",
  "name": "Baseline Rule Pack (lexical security patterns)",
  "owner": "rules",
  "version": "0.0.1",
  "description": "A pack of pre-built lexical rules for common security/baseline defect patterns. Proving plug (INV-2.3): coexists with rules-evaluators against the non-exclusive rules owner.",
  "capabilities": [
    "evaluate"
  ],
  "targets": {
    "providers": [],
    "plans": [],
    "env": []
  },
  "dependencies": {
    "requires": [],
    "recommends": []
  },
  "permissions": {
    "network": [],
    "filesystem": [],
    "env": [],
    "mutatesTools": false
  },
  "entrypoint": "./plug.ts",
  "hooks": false,
  "mcp": false
}
