{
  "$schema": "../../../packages/socket/schemas/plug-manifest.v1.json",
  "schemaVersion": "1.0.0",
  "id": "review-agent-opencode",
  "name": "OpenCode CLI Agent",
  "owner": "review",
  "version": "0.0.1",
  "description": "Agent backend that shells out to the developer's installed `opencode` binary. Zero-config: uses the developer's existing model login — no API keys needed (goal §1.1, A13). Detected on PATH via native-agent detection. Uses `opencode run --format json` (the one-shot non-interactive mode, verified against opencode-ai 1.16.2). Implements P-plugin-3 Agent adapter. Completes the three-binary zero-config wedge (claude + codex + opencode).",
  "capabilities": [
    "agent-backend"
  ],
  "targets": {
    "providers": [],
    "plans": [],
    "env": []
  },
  "dependencies": {
    "requires": [],
    "recommends": []
  },
  "permissions": {
    "network": [],
    "filesystem": [],
    "env": [],
    "mutatesTools": false
  },
  "entrypoint": "./plug.ts",
  "hooks": false,
  "mcp": false
}
