{
  "$schema": "../../../packages/socket/schemas/plug-manifest.v1.json",
  "schemaVersion": "1.0.0",
  "id": "review-agent-gitgecko-native",
  "name": "GitGecko-Native Agent",
  "owner": "review",
  "version": "0.0.1",
  "description": "First-party agent backend implementing the Agent adapter (P-plugin-3). A minimal agent loop for air-gapped/no-external-agent deployments. Salvages SWE-agent's lean agent-computer interface (P-plugin-10). The default brain when no external agent (Claude Code/OpenCode) is configured.",
  "capabilities": [
    "agent-backend"
  ],
  "targets": {
    "providers": [],
    "plans": [],
    "env": []
  },
  "dependencies": {
    "requires": [],
    "recommends": []
  },
  "permissions": {
    "network": [],
    "filesystem": [],
    "env": [],
    "mutatesTools": false
  },
  "entrypoint": "./plug.ts",
  "hooks": false,
  "mcp": false
}
