{
  "$schema": "../../../packages/socket/schemas/plug-manifest.v1.json",
  "schemaVersion": "1.0.0",
  "id": "rules-evaluators",
  "name": "Rule Evaluators (structural + lexical + llm)",
  "owner": "rules",
  "version": "0.0.1",
  "description": "Three rule evaluators: structural (ast-grep napi, P-codeintel-11), lexical (regex), llm (NL path-instructions, CR-§8). Deterministic-first evaluation, source-tagged findings. The anti-noise wedge neither CodeRabbit nor Greptile has.",
  "capabilities": [
    "evaluate"
  ],
  "targets": {
    "providers": [],
    "plans": [],
    "env": []
  },
  "dependencies": {
    "requires": [],
    "recommends": []
  },
  "permissions": {
    "network": [],
    "filesystem": [],
    "env": [],
    "mutatesTools": false
  },
  "entrypoint": "./plug.ts",
  "hooks": false,
  "mcp": false
}
