{
  "$schema": "../../../packages/socket/schemas/plug-manifest.v1.json",
  "schemaVersion": "1.0.0",
  "id": "review-agent-pi",
  "name": "PI Coding Agent",
  "owner": "review",
  "version": "0.0.1",
  "description": "Repository-aware PI coding-agent SDK backend for local and custom model endpoints.",
  "capabilities": ["agent-backend"],
  "targets": { "providers": [], "plans": [], "env": [] },
  "dependencies": { "requires": [], "recommends": [] },
  "permissions": { "network": [], "filesystem": ["repo:read"], "env": [], "mutatesTools": false },
  "entrypoint": "./plug.ts",
  "hooks": false,
  "mcp": false
}
