{
  "$schema": "../../../packages/socket/schemas/plug-manifest.v1.json",
  "schemaVersion": "1.0.0",
  "id": "code-intel-tree-sitter-parse",
  "name": "tree-sitter Parse",
  "owner": "code-intel",
  "version": "0.0.1",
  "description": "Universal tree-sitter parser. Parses source → AST, emits def/ref tags via salvaged aider SCM queries (P-codeintel-2). The substrate every other code-intel plug builds on (P-codeintel-13).",
  "capabilities": [
    "parse"
  ],
  "targets": {
    "providers": [],
    "plans": [],
    "env": []
  },
  "dependencies": {
    "requires": [],
    "recommends": []
  },
  "permissions": {
    "network": [],
    "filesystem": [],
    "env": [],
    "mutatesTools": false
  },
  "entrypoint": "./plug.ts",
  "hooks": false,
  "mcp": false
}
