{
  "$schema": "../../../packages/socket/schemas/plug-manifest.v1.json",
  "schemaVersion": "1.0.0",
  "id": "code-intel-embed",
  "name": "Embeddings Indexer",
  "owner": "code-intel",
  "version": "0.0.1",
  "description": "Embeds chunks via a pluggable EmbeddingProvider (BYO model — G5), stores vectors + content in a dual store (LanceDB+SQLite prod, in-memory tests), retrieves by cosine nearest-neighbor. Salvaged from continue's LanceDbIndex (P-codeintel-10). Fourth step of Greptile's pipeline.",
  "capabilities": [
    "embed"
  ],
  "targets": {
    "providers": [],
    "plans": [],
    "env": []
  },
  "dependencies": {
    "requires": [],
    "recommends": []
  },
  "permissions": {
    "network": [],
    "filesystem": [],
    "env": [],
    "mutatesTools": false
  },
  "entrypoint": "./plug.ts",
  "hooks": false,
  "mcp": false
}
