{
  "$schema": "../../../packages/socket/schemas/plug-manifest.v1.json",
  "schemaVersion": "1.0.0",
  "id": "mcp-gateway-meta-tools",
  "name": "MCP Meta-Tools (operational introspection)",
  "owner": "mcp-gateway",
  "version": "0.0.1",
  "description": "Operational/introspection MCP tools: list_plugs, health_check, describe_models. Proving plug (INV-2.3): coexists with mcp-gateway-exposers against the non-exclusive mcp-gateway owner.",
  "capabilities": [
    "expose"
  ],
  "targets": {
    "providers": [],
    "plans": [],
    "env": []
  },
  "dependencies": {
    "requires": [],
    "recommends": []
  },
  "permissions": {
    "network": [],
    "filesystem": [],
    "env": [],
    "mutatesTools": false
  },
  "entrypoint": "./plug.ts",
  "hooks": false,
  "mcp": true
}
