{
  "$schema": "../../../packages/socket/schemas/plug-manifest.v1.json",
  "schemaVersion": "1.0.0",
  "id": "mcp-gateway-exposers",
  "name": "MCP Tool Exposers (code-intel + rules + review)",
  "owner": "mcp-gateway",
  "version": "0.0.1",
  "description": "Bridges the proven owner capabilities into MCP tools any agent can consume (G7). search_code (code-intel); evaluate_rule (rules); run_review (review). The inverse of CodeRabbit's MCP-client posture. Repo-map remains a deferred capability until its owner is active.",
  "capabilities": [
    "expose"
  ],
  "targets": {
    "providers": [],
    "plans": [],
    "env": []
  },
  "dependencies": {
    "requires": [],
    "recommends": []
  },
  "permissions": {
    "network": [],
    "filesystem": [],
    "env": [],
    "mutatesTools": false
  },
  "entrypoint": "./plug.ts",
  "hooks": false,
  "mcp": true
}
