{
  "$schema": "../../../packages/socket/schemas/plug-manifest.v1.json",
  "schemaVersion": "1.0.0",
  "id": "review-agent-codex",
  "name": "Codex CLI Agent",
  "owner": "review",
  "version": "0.0.1",
  "description": "Agent backend that shells out to the developer's installed `codex` binary (OpenAI Codex CLI). Zero-config: uses the developer's existing OpenAI login — no API keys needed (goal §1.1, A13). Detected on PATH via native-agent detection. Implements P-plugin-3 Agent adapter.",
  "capabilities": [
    "agent-backend"
  ],
  "targets": {
    "providers": [],
    "plans": [],
    "env": []
  },
  "dependencies": {
    "requires": [],
    "recommends": []
  },
  "permissions": {
    "network": [],
    "filesystem": [],
    "env": [],
    "mutatesTools": false
  },
  "entrypoint": "./plug.ts",
  "hooks": false,
  "mcp": false
}
