{
  "$schema": "../../../packages/socket/schemas/plug-manifest.v1.json",
  "schemaVersion": "1.0.0",
  "id": "model-anthropic",
  "name": "Anthropic Models",
  "owner": "model",
  "version": "0.0.1",
  "description": "Anthropic LLM backend (Claude). Proving plug for the model owner socket (INV-2.3 — interchangeable with model-openai). BYOK (G5): user provides ANTHROPIC_API_KEY.",
  "capabilities": [
    "complete",
    "stream"
  ],
  "targets": {
    "providers": [],
    "plans": [],
    "env": []
  },
  "dependencies": {
    "requires": [],
    "recommends": []
  },
  "permissions": {
    "network": [
      "api.anthropic.com:443"
    ],
    "filesystem": [],
    "env": [
      "ANTHROPIC_API_KEY"
    ],
    "mutatesTools": false
  },
  "entrypoint": "./plug.ts",
  "hooks": false,
  "mcp": false
}
