{
  "$schema": "../../../packages/socket/schemas/plug-manifest.v1.json",
  "schemaVersion": "1.0.0",
  "id": "review-agent-claude-code",
  "name": "Claude Code CLI Agent",
  "owner": "review",
  "version": "0.0.1",
  "description": "Agent backend that shells out to the developer's installed `claude` binary (Anthropic Claude Code CLI). Zero-config: uses the developer's existing Anthropic login — no API keys needed (goal §1.1, A13). Detected on PATH via native-agent detection (highest preference). Implements P-plugin-3 Agent adapter. Salvaged invocation shape from pullfrog's agents/claude.ts (P-plugin-13).",
  "capabilities": [
    "agent-backend"
  ],
  "targets": {
    "providers": [],
    "plans": [],
    "env": []
  },
  "dependencies": {
    "requires": [],
    "recommends": []
  },
  "permissions": {
    "network": [],
    "filesystem": [],
    "env": [],
    "mutatesTools": false
  },
  "entrypoint": "./plug.ts",
  "hooks": false,
  "mcp": false
}
