{
  "$schema": "../../../packages/socket/schemas/plug-manifest.v1.json",
  "schemaVersion": "1.0.0",
  "id": "code-intel-retrieve",
  "name": "Hybrid Retrieval Fusion",
  "owner": "code-intel",
  "version": "0.0.1",
  "description": "Fuses embeddings (50%) + lexical/trigram (25%) + graph expansion (25%) into one ranked, deduplicated result set. Salvaged from continue's NoRerankerRetrievalPipeline (P-codeintel-9). Fifth step of Greptile's pipeline — the point where gitgecko becomes a usable Greptile competitor.",
  "capabilities": [
    "retrieve"
  ],
  "targets": {
    "providers": [],
    "plans": [],
    "env": []
  },
  "dependencies": {
    "requires": [],
    "recommends": []
  },
  "permissions": {
    "network": [],
    "filesystem": [],
    "env": [],
    "mutatesTools": false
  },
  "entrypoint": "./plug.ts",
  "hooks": false,
  "mcp": false
}
