{
  "$schema": "../../../packages/socket/schemas/plug-manifest.v1.json",
  "schemaVersion": "1.0.0",
  "id": "job-dispatch-sqlite",
  "name": "SQLite Job Dispatch",
  "owner": "job-dispatch",
  "version": "0.0.1",
  "description": "Durable SQLite-backed review and index work dispatch with leases and bounded retries.",
  "capabilities": ["review", "index"],
  "targets": { "providers": ["sqlite"], "plans": [], "env": [] },
  "dependencies": { "requires": [], "recommends": [] },
  "permissions": {
    "network": [],
    "filesystem": ["GITGECKO_DB_PATH"],
    "env": ["GITGECKO_DB_PATH"],
    "mutatesTools": true
  },
  "entrypoint": "./plug.ts",
  "hooks": false,
  "mcp": false
}
